UC1

mysql> CREATE DATABASE payroll_service;
Query OK, 1 row affected (0.03 sec)

mysql> SHOW DATABASES;
+--------------------+
| Database           |
+--------------------+
| addressbook        |
| information_schema |
| mysql              |
| payroll_service    |
| performance_schema |
| sakila             |
| sys                |
| world              |
+--------------------+
8 rows in set (0.00 sec)

mysql> use payroll_service;
Database changed

mysql> select database();
+-----------------+
| database()      |
+-----------------+
| payroll_service |
+-----------------+
1 row in set (0.00 sec)

UC2

mysql> CREATE TABLE employee_payroll
    -> (
    -> id INT unsigned NOT NULL AUTO_INCREMENT,
    -> name VARCHAR(50),
    -> salary DOUBLE NOT NULL,
    -> start DATE NOT NULL,
    -> PRIMARY KEY(id)
    -> );
Query OK, 0 rows affected (0.04 sec)

mysql> describe employee_payroll;
+--------+--------------+------+-----+---------+----------------+
| Field  | Type         | Null | Key | Default | Extra          |
+--------+--------------+------+-----+---------+----------------+
| id     | int unsigned | NO   | PRI | NULL    | auto_increment |
| name   | varchar(50)  | YES  |     | NULL    |                |
| salary | double       | NO   |     | NULL    |                |
| start  | date         | NO   |     | NULL    |                |
+--------+--------------+------+-----+---------+----------------+
4 rows in set (0.03 sec)

UC3

mysql> insert into employee_payroll (name, salary, start) values
    -> ('Shreya', 10000000.00, '2018-02-15'),
    -> ('Kendu', 20000000.00, '2019-07-18'),
    -> ('Sharan', 4000000.00, '2020-09-08');
Query OK, 3 rows affected (0.03 sec)
Records: 3  Duplicates: 0  Warnings: 0

UC4

mysql> select * from employee_payroll;
+----+---------+----------+------------+
| id | name    | salary   | start      |
+----+---------+----------+------------+
|  1 | Shreya  | 10000000 | 2018-02-15 |
|  2 | Kendu   | 20000000 | 2019-07-18 |
|  3 | Sharan  |  4000000 | 2020-09-08 |
+----+---------+----------+------------+
3 rows in set (0.00 sec)

UC5

mysql> SELECT salary FROM employee_Payroll WHERE name = 'Kendu';
+----------+
| salary   |
+----------+
| 20000000 |
+----------+
1 row in set (0.00 sec)

`mysql> SELECT * FROM employee_payroll WHERE start BETWEEN CAST('2018-01-01' AS DATE) AND DATE (NOW());
+----+---------+----------+------------+
| id | name    | salary   | start      |
+----+---------+----------+------------+
|  1 | Shreya  | 10000000 | 2018-02-15 |
|  2 | Kendu   | 20000000 | 2019-07-18 |
|  3 | Sharan  |  4000000 | 2020-09-08 |
+----+---------+----------+------------+
3 rows in set (0.00 sec)

UC6

mysql> alter table employee_payroll add gender CHAR(1) after name;
Query OK, 0 rows affected (0.07 sec)
Records: 0  Duplicates: 0  Warnings: 0

mysql> update employee_payroll set gender = 'M'where name = 'Kendu';
Query OK, 1 row affected (0.02 sec)
Rows matched: 1  Changed: 1  Warnings: 0

mysql> select * from employee_payroll;
+----+---------+--------+----------+------------+
| id | name    | gender | salary   | start      |
+----+---------+--------+----------+------------+
|  1 | Shreya  | NULL   | 10000000 | 2018-02-15 |
|  2 | Kendu   | M      | 20000000 | 2019-07-18 |
|  3 | Sharam  | NULL   |  4000000 | 2020-09-08 |
+----+---------+--------+----------+------------+
3 rows in set (0.00 sec)

mysql> update employee_payroll set gender = 'F'where name = 'Shreya';
Query OK, 1 row affected (0.01 sec)
Rows matched: 1  Changed: 1  Warnings: 0

mysql> select * from employee_payroll;
+----+---------+--------+----------+------------+
| id | name    | gender | salary   | start      |
+----+---------+--------+----------+------------+
|  1 | Shreya  | F      | 10000000 | 2018-02-15 |
|  2 | Kendu   | M      | 20000000 | 2019-07-18 |
|  3 | Sharan  | NULL   |  4000000 | 2020-09-08 |
+----+---------+--------+----------+------------+
3 rows in set (0.00 sec)

mysql> update employee_payroll set gender = 'M' where name = 'Sharan';
Query OK, 1 row affected (0.01 sec)
Rows matched: 1  Changed: 1  Warnings: 0

mysql> select * from employee_payroll;
+----+---------+--------+----------+------------+
| id | name    | gender | salary   | start      |
+----+---------+--------+----------+------------+
|  1 | Shreya  | F      | 10000000 | 2018-02-15 |
|  2 | Kendu   | M      | 20000000 | 2019-07-18 |
|  3 | Sharan  | M      |  4000000 | 2020-09-08 |
+----+---------+--------+----------+------------+
3 rows in set (0.02 sec)

mysql> select * from employee_payroll;
+----+---------+--------+----------+------------+
| id | name    | gender | salary   | start      |
+----+---------+--------+----------+------------+
|  1 | Shreya  | F      | 10000000 | 2018-02-15 |
|  2 | Kendu   | M      | 20000000 | 2019-07-18 |
|  3 | Sharan  | M      |  4000000 | 2020-09-08 |
+----+---------+--------+----------+------------+
3 rows in set (0.00 sec)

UC7

mysql> INSERT INTO employee_payroll (name, gender, salary, start) VALUES
    -> ('Shivani', 'F', 800000, '2020-12-20'),
    -> ('Yashu', 'F', 7800000, '2021-04-16');
Query OK, 2 rows affected (0.01 sec)
Records: 2  Duplicates: 0  Warnings: 0

mysql> select * from employee_payroll;
+----+-------------+--------+----------+------------+
| id | name        | gender | salary   | start      |
+----+-------------+--------+----------+------------+
|  1 | Shreya      | F      | 10000000 | 2018-05-04 |
|  2 | Kendu       | M      | 20000000 | 2019-07-14 |
|  3 | Sharan      | M      |  3000000 | 2020-08-19 |
|  4 | Shivani     | F      |   800000 | 2020-12-20 |
|  5 | Yashu       | F      |  7800000 | 2021-04-16 |
+----+-------------+--------+----------+------------+
5 rows in set (0.02 sec)

mysql> select sum(salary) from employee_payroll where gender = 'F' group by gender;
+-------------+
| sum(salary) |
+-------------+
|    18600000 |
+-------------+
1 row in set (0.00 sec)

mysql> select avg(salary) from employee_payroll where gender = 'F' group by gender;
+-------------+
| avg(salary) |
+-------------+
|     6200000 |
+-------------+
1 row in set (0.00 sec)

mysql> select min(salary) from employee_payroll where gender = 'F' group by gender;
+-------------+
| min(salary) |
+-------------+
|      800000 |
+-------------+
1 row in set (0.00 sec)

mysql> select max(salary) from employee_payroll where gender = 'F' group by gender;
+-------------+
| max(salary) |
+-------------+
|    10000000 |
+-------------+
1 row in set (0.00 sec)

mysql> select count(*) from employee_payroll where gender = 'F' group by gender;
+----------+
| count(*) |
+----------+
|        3 |
+----------+
1 row in set (0.00 sec)

mysql> select sum(salary) from employee_payroll where gender = 'M' group by gender;
+-------------+
| sum(salary) |
+-------------+
|    23000000 |
+-------------+
1 row in set (0.00 sec)

mysql> select avg(salary) from employee_payroll where gender = 'M' group by gender;
+-------------+
| avg(salary) |
+-------------+
|    11500000 |
+-------------+
1 row in set (0.00 sec)

mysql> select min(salary) from employee_payroll where gender = 'M' group by gender;
+-------------+
| min(salary) |
+-------------+
|     3000000 |
+-------------+
1 row in set (0.00 sec)

mysql> select max(salary) from employee_payroll where gender = 'M' group by gender;
+-------------+
| max(salary) |
+-------------+
|    20000000 |
+-------------+
1 row in set (0.00 sec)

mysql> select count(*) from employee_payroll where gender = 'M' group by gender;
+----------+
| count(*) |
+----------+
|        2 |
+----------+
1 row in set (0.00 sec)